{
  "report_id": "coh.demo.christianity.route_tree.v1",
  "target_id": "route_tree.christianity.v1",
  "target_type": "route_tree",
  "internal": {
    "score": 0.771,
    "dimensions": {
      "authority_alignment": 0.78,
      "doctrine_order_alignment": 0.72,
      "practice_alignment": 0.7,
      "source_tier_alignment": 0.74,
      "tension_handling": 0.84,
      "no_contradiction_with_active_core": 0.9
    }
  },
  "external": {
    "score": 0.822,
    "dimensions": {
      "parent_child_consistency": 0.88,
      "sibling_boundary_clarity": 0.85,
      "crosswalk_clarity": 0.8,
      "provenance_integrity": 0.7,
      "machine_contract_validity": 0.95,
      "lifecycle_fit": 0.76
    }
  },
  "overall_score": 0.791,
  "band": "yellow",
  "blocking_failures": [],
  "warnings": [
    "Route tree is clear enough as scaffold; most subbranches remain stubs."
  ],
  "review_required": [
    "christianity_branch_reviewers",
    "noesis_steward",
    "logos_reviewer_for_crosswalks"
  ],
  "recommended_lifecycle_state": "experimental",
  "audit": {
    "created_at": "2026-05-26T15:48:34.996196+00:00",
    "created_by": "starter_scaffold",
    "method": "weighted_demo_coherence_model_v1",
    "source_files": [
      "branches/christianity/route-tree.yaml"
    ]
  }
}
